{
  "schema_version": "1.0.0",
  "artifact_type": "production",
  "artifact_scope": "national",
  "locale": "en",
  "generated_for_date": "2026-08-09",
  "site": {
    "site_id": "madoguchi-mimamori",
    "default_locale": "ja",
    "supported_locales": [
      "ja",
      "en"
    ],
    "site_name": "Madoguchi Mimamori",
    "subtitle": "Guide to Official Information from Public Institutions and Related Organizations",
    "short_description": "A guide that helps users find the responsible public institution or related organization and proceed to that organization's own official information during disasters and other situations.",
    "purpose": "Helps users reach official information from public institutions and related organizations quickly.",
    "free_use_notice": "Free to use. There are no ads or affiliate links, and no sign-in is required.",
    "external_site_notice": "Destinations are external official websites. Check the linked site for the latest information.",
    "disclaimer_summary": "This is not an official government website, breaking-news service, or fact-checking service. Listing does not guarantee the overall reliability of an organization or the accuracy of information at a destination.",
    "contact_url": "https://portfolio.na0aaooq.com/en/contact.html"
  },
  "regions": [
    {
      "region_id": "region-kumamoto-prefecture",
      "region_slug": "kumamoto",
      "navigation_label": "Kumamoto Prefecture and Kumamoto City",
      "scope_note": "Includes information for Kumamoto Prefecture as a whole and information for Kumamoto City.",
      "path": "/en/regions/kumamoto/"
    }
  ]
}
