{
  "schema_version": "1.0.0",
  "artifact_type": "production",
  "artifact_scope": "national",
  "locale": "ja",
  "generated_for_date": "2026-08-09",
  "site": {
    "site_id": "madoguchi-mimamori",
    "default_locale": "ja",
    "supported_locales": [
      "ja",
      "en"
    ],
    "site_name": "まどぐちみまもり",
    "subtitle": "公的機関・関係団体の公式情報案内",
    "short_description": "災害時などに確認したい内容から担当する公的機関・関係団体を見つけ、その団体自身の公式発表へ進むための案内サイトです。",
    "purpose": "公的機関・関係団体の公式情報へ短時間で到達できるよう案内します。",
    "free_use_notice": "無料で利用でき、広告・アフィリエイトはなく、ログインも不要です。",
    "external_site_notice": "案内先は外部の公式サイトです。最新情報はリンク先で確認してください。",
    "disclaimer_summary": "行政機関が運営する公式サイト、速報サイト、情報の真偽判定サービスではありません。掲載は団体全体の信頼性や、案内先の情報の正しさを保証するものではありません。",
    "contact_url": "https://portfolio.na0aaooq.com/contact.html"
  },
  "regions": [
    {
      "region_id": "region-kumamoto-prefecture",
      "region_slug": "kumamoto",
      "navigation_label": "熊本県・熊本市",
      "scope_note": "熊本県全域向けの情報と、熊本市向けの情報を掲載しています。",
      "path": "/ja/regions/kumamoto/"
    }
  ]
}
